{
  "catalog_version": "0.4.0",
  "updated_at": "2026-08-12",
  "note": "Modelos só entram com verificação datada na documentação oficial do provedor. models[] = pós-processamento (USD por milhão de tokens, preço padrão como teto conservador); asr_models[] = transcrição em nuvem (REQ-023/ADR-0002 D2, USD por hora de áudio; preços da pesquisa datada em docs/MATRIZ_CUSTO_ASR.md). recommended de ASR exige wer_ptbr medido no corpus próprio (CA-5). Anthropic: a API não aceita áudio em 2026 — sem asr_models.",
  "providers": [
    {
      "id": "google-gemini",
      "name": "Google (Gemini)",
      "api_base": "https://generativelanguage.googleapis.com",
      "auth": {
        "type": "api_key",
        "location": "header",
        "field": "x-goog-api-key"
      },
      "docs_url": "https://ai.google.dev/gemini-api/docs",
      "pricing_url": "https://ai.google.dev/gemini-api/docs/pricing",
      "models": [],
      "models_verified_at": null,
      "asr_models": [
        {
          "id": "gemini-3.5-flash-lite",
          "name": "Gemini 3.5 Flash-Lite (áudio)",
          "modes": [
            "batch"
          ],
          "languages_verified": [
            "pt"
          ],
          "pricing": {
            "usd_per_audio_hour_batch": 0.068,
            "usd_per_audio_hour_stream": null,
            "billing_granularity": "per_token",
            "verified_at": "2026-08-08",
            "source_url": "https://ai.google.dev/gemini-api/docs/pricing"
          },
          "wer_ptbr": 0.0202,
          "recommended": false,
          "notes": "WER pt-BR 2,02 % medido no corpus próprio (leitura, N=1833, referência revisada 1×; 2026-08-12, bench/results/wer_nuvem_20260812.md) — melhor preço entre os medidos (US$ 0,068/h, derivado da tarifa por token; suposição em docs/MATRIZ_CUSTO_ASR.md). Em áudio longo inteiro o modelo para voluntariamente (~60 % das palavras, finishReason=STOP): o cliente do núcleo fatia > 8 min e recusa resposta com finishReason != STOP."
        }
      ]
    },
    {
      "id": "anthropic",
      "name": "Anthropic (Claude)",
      "api_base": "https://api.anthropic.com",
      "auth": {
        "type": "api_key",
        "location": "header",
        "field": "x-api-key"
      },
      "docs_url": "https://docs.claude.com",
      "pricing_url": "https://claude.com/pricing",
      "models": [
        {
          "id": "claude-opus-5",
          "name": "Claude Opus 5",
          "context_window_tokens": 1000000,
          "max_output_tokens": 128000,
          "pricing": {
            "input_usd_per_mtok": 5.0,
            "output_usd_per_mtok": 25.0,
            "verified_at": "2026-08-03",
            "source_url": "https://platform.claude.com/docs/en/about-claude/models/overview"
          },
          "notes": "Recomendado pela documentação como ponto de partida para trabalho complexo."
        },
        {
          "id": "claude-sonnet-5",
          "name": "Claude Sonnet 5",
          "context_window_tokens": 1000000,
          "max_output_tokens": 128000,
          "pricing": {
            "input_usd_per_mtok": 3.0,
            "output_usd_per_mtok": 15.0,
            "verified_at": "2026-08-03",
            "source_url": "https://platform.claude.com/docs/en/about-claude/models/overview"
          },
          "notes": "Equilíbrio velocidade×qualidade. Preço introdutório de 2/10 USD por MTok vigente até 2026-08-31; registrado o padrão (teto conservador)."
        },
        {
          "id": "claude-haiku-4-5",
          "name": "Claude Haiku 4.5",
          "context_window_tokens": 200000,
          "max_output_tokens": 64000,
          "pricing": {
            "input_usd_per_mtok": 1.0,
            "output_usd_per_mtok": 5.0,
            "verified_at": "2026-08-03",
            "source_url": "https://platform.claude.com/docs/en/about-claude/models/overview"
          },
          "notes": "Mais rápido e barato; contexto de 200 mil tokens (exige particionamento mais cedo em sessões longas)."
        },
        {
          "id": "claude-fable-5",
          "name": "Claude Fable 5",
          "context_window_tokens": 1000000,
          "max_output_tokens": 128000,
          "pricing": {
            "input_usd_per_mtok": 10.0,
            "output_usd_per_mtok": 50.0,
            "verified_at": "2026-08-03",
            "source_url": "https://platform.claude.com/docs/en/about-claude/models/overview"
          },
          "notes": "Capacidade máxima disponível ao público; custo mais alto — usar quando a qualidade justificar."
        }
      ],
      "models_verified_at": "2026-08-03"
    },
    {
      "id": "openai",
      "name": "OpenAI",
      "api_base": "https://api.openai.com",
      "auth": {
        "type": "bearer",
        "location": "header",
        "field": "Authorization"
      },
      "docs_url": "https://platform.openai.com/docs",
      "pricing_url": "https://platform.openai.com/docs/pricing",
      "models": [],
      "models_verified_at": null,
      "asr_models": [
        {
          "id": "gpt-4o-mini-transcribe",
          "name": "GPT-4o mini Transcribe",
          "modes": [
            "batch",
            "stream"
          ],
          "languages_verified": [
            "pt"
          ],
          "pricing": {
            "usd_per_audio_hour_batch": 0.18,
            "usd_per_audio_hour_stream": 0.18,
            "billing_granularity": "unknown",
            "verified_at": "2026-08-08",
            "source_url": "https://platform.openai.com/docs/pricing"
          },
          "wer_ptbr": 0.0147,
          "recommended": true,
          "notes": "WER pt-BR 1,47 % medido no corpus próprio (leitura, N=1833, referência revisada 1×; 2026-08-12, bench/results/wer_nuvem_20260812.md) — empata com o líder local (Voxtral Mini 3B). Limite de ~2 000 tokens de saída por requisição: o cliente do núcleo fatia áudio > 8 min e usa os limites reais das fatias como timestamps. Streaming incluso no mesmo preço."
        },
        {
          "id": "gpt-4o-transcribe",
          "name": "GPT-4o Transcribe",
          "modes": [
            "batch",
            "stream"
          ],
          "languages_verified": [
            "pt"
          ],
          "pricing": {
            "usd_per_audio_hour_batch": 0.36,
            "usd_per_audio_hour_stream": 0.36,
            "billing_granularity": "unknown",
            "verified_at": "2026-08-08",
            "source_url": "https://platform.openai.com/docs/pricing"
          },
          "wer_ptbr": 0.0164,
          "recommended": false,
          "notes": "WER pt-BR 1,64 % medido no corpus próprio (mesma régua, 2026-08-12) — pior e 2× mais caro que o gpt-4o-mini-transcribe na leitura; sem motivo medido para preferi-lo em lote. Mesmo limite de saída (cliente fatia > 8 min). 3,3 % AA-WER publicado (inglês)."
        }
      ]
    },
    {
      "id": "xai",
      "name": "xAI (Grok)",
      "api_base": "https://api.x.ai",
      "auth": {
        "type": "bearer",
        "location": "header",
        "field": "Authorization"
      },
      "docs_url": "https://docs.x.ai",
      "pricing_url": "https://docs.x.ai",
      "models": [],
      "models_verified_at": null,
      "asr_models": [
        {
          "id": "grok-stt",
          "name": "Grok STT",
          "modes": [
            "batch",
            "stream"
          ],
          "languages_verified": [
            "pt"
          ],
          "pricing": {
            "usd_per_audio_hour_batch": 0.1,
            "usd_per_audio_hour_stream": 0.2,
            "billing_granularity": "unknown",
            "verified_at": "2026-08-08",
            "source_url": "https://docs.x.ai"
          },
          "wer_ptbr": null,
          "recommended": false,
          "notes": "Lançado em abr/2026; ~25 idiomas incl. pt (rodada 4 da pesquisa, 2026-08-08); streaming por WebSocket (F3)."
        }
      ]
    },
    {
      "id": "mistral",
      "name": "Mistral (Voxtral)",
      "api_base": "https://api.mistral.ai",
      "auth": {
        "type": "bearer",
        "location": "header",
        "field": "Authorization"
      },
      "docs_url": "https://docs.mistral.ai",
      "pricing_url": "https://mistral.ai/news/voxtral-transcribe-2/",
      "models": [],
      "models_verified_at": null,
      "asr_models": [
        {
          "id": "voxtral-mini-transcribe-v2",
          "name": "Voxtral Mini Transcribe V2",
          "modes": [
            "batch"
          ],
          "languages_verified": [
            "pt"
          ],
          "pricing": {
            "usd_per_audio_hour_batch": 0.18,
            "usd_per_audio_hour_stream": null,
            "billing_granularity": "unknown",
            "verified_at": "2026-08-08",
            "source_url": "https://mistral.ai/news/voxtral-transcribe-2/"
          },
          "wer_ptbr": null,
          "recommended": false,
          "notes": "Família cuja variante local Mini 3B lidera o corpus próprio (WER 1,47 %, sessão 24) — candidato natural ao 1º cliente de nuvem; wer_ptbr do serviço só via corpus próprio (PRB-0014)."
        },
        {
          "id": "voxtral-realtime-api",
          "name": "Voxtral Realtime (API)",
          "modes": [
            "stream"
          ],
          "languages_verified": [
            "pt"
          ],
          "pricing": {
            "usd_per_audio_hour_batch": null,
            "usd_per_audio_hour_stream": 0.36,
            "billing_granularity": "unknown",
            "verified_at": "2026-08-08",
            "source_url": "https://mistral.ai/news/voxtral-transcribe-2/"
          },
          "wer_ptbr": null,
          "recommended": false,
          "notes": "Somente streaming (sub-200 ms) — fica para a F3 (ADR-0002 D5)."
        }
      ],
      "notes": "Provedor só de ASR (REQ-023); sem modelos de pós-processamento."
    }
  ],
  "schema_version": "1.0.0"
}
